mysql> desc InvoiceLine;
+---------------+---------------+------+-----+---------+----------------+
| Field         | Type          | Null | Key | Default | Extra          |
+---------------+---------------+------+-----+---------+----------------+
| InvoiceLineId | int(11)       | NO   | PRI | NULL    | auto_increment |
| InvoiceId     | int(11)       | NO   | MUL | NULL    |                |
| TrackId       | int(11)       | NO   | MUL | NULL    |                |
| UnitPrice     | decimal(10,2) | NO   |     | NULL    |                |
| Quantity      | int(11)       | NO   |     | NULL    |                |
+---------------+---------------+------+-----+---------+----------------+
5 rows in set (0.00 sec)

mysql> source test.sql
ERROR 1064 (42000): You have an error in your SQL syntax; check the manual that corresponds to your MySQL server version for the right syntax to use near '*) from Track' at line 1
ERROR 1064 (42000): You have an error in your SQL syntax; check the manual that corresponds to your MySQL server version for the right syntax to use near '*) from Artist' at line 1
mysql> source test.sql;
ERROR 1064 (42000): You have an error in your SQL syntax; check the manual that corresponds to your MySQL server version for the right syntax to use near '*) from Track' at line 1
ERROR 1064 (42000): You have an error in your SQL syntax; check the manual that corresponds to your MySQL server version for the right syntax to use near '*) from Artist' at line 1
mysql> source test.sql;
ERROR 1064 (42000): You have an error in your SQL syntax; check the manual that corresponds to your MySQL server version for the right syntax to use near '*) from Track' at line 1
ERROR 1064 (42000): You have an error in your SQL syntax; check the manual that corresponds to your MySQL server version for the right syntax to use near '*) from Artist' at line 1
mysql> source test.sql;
+----------+
| count(*) |
+----------+
|     3503 |
+----------+
1 row in set (0.00 sec)

+----------+
| count(*) |
+----------+
|      275 |
+----------+
1 row in set (0.00 sec)

mysql> select * from Album limit 5
    -> ;
+---------+---------------------------------------+----------+
| AlbumId | Title                                 | ArtistId |
+---------+---------------------------------------+----------+
|       1 | For Those About To Rock We Salute You |        1 |
|       2 | Balls to the Wall                     |        2 |
|       3 | Restless and Wild                     |        2 |
|       4 | Let There Be Rock                     |        1 |
|       5 | Big Ones                              |        3 |
+---------+---------------------------------------+----------+
5 rows in set (0.00 sec)

mysql> select Title, Name from Album
    -> join Artist on Album.ArtistId = Artist.ArtistId
    -> limit 5;
+---------------------------------------+-----------+
| Title                                 | Name      |
+---------------------------------------+-----------+
| For Those About To Rock We Salute You | AC/DC     |
| Balls to the Wall                     | Accept    |
| Restless and Wild                     | Accept    |
| Let There Be Rock                     | AC/DC     |
| Big Ones                              | Aerosmith |
+---------------------------------------+-----------+
5 rows in set (0.00 sec)

mysql> insert into Genre (Name) values ("Cajke", "Duhovna");
ERROR 1136 (21S01): Column count doesn't match value count at row 1
mysql> insert into Genre (Name) values ("Duhovna);
    "> insert into Genre (Name) values ("Duhovna");
    "> ;
    "> "
    -> 
    -> ""
    -> +
    -> insert into Genre (Name) values ("Duhovna");
ERROR 1064 (42000): You have an error in your SQL syntax; check the manual that corresponds to your MySQL server version for the right syntax to use near 'Duhovna");
;
"

""
+
insert into Genre (Name) values ("Duhovna")' at line 1
mysql> insert into Genre (Name) values ("Duhovna");
Query OK, 1 row affected (0.02 sec)

mysql> select * from Genre
    -> ;
+---------+--------------------+
| GenreId | Name               |
+---------+--------------------+
|       1 | Rock               |
|       2 | Jazz               |
|       3 | Metal              |
|       4 | Alternative & Punk |
|       5 | Rock And Roll      |
|       6 | Blues              |
|       7 | Latin              |
|       8 | Reggae             |
|       9 | Pop                |
|      10 | Soundtrack         |
|      11 | Bossa Nova         |
|      12 | Easy Listening     |
|      13 | Heavy Metal        |
|      14 | R&B/Soul           |
|      15 | Electronica/Dance  |
|      16 | World              |
|      17 | Hip Hop/Rap        |
|      18 | Science Fiction    |
|      19 | TV Shows           |
|      20 | Sci Fi & Fantasy   |
|      21 | Drama              |
|      22 | Comedy             |
|      23 | Alternative        |
|      24 | Classical          |
|      25 | Opera              |
|      26 | Duhovna            |
+---------+--------------------+
26 rows in set (0.00 sec)

mysql> select LAST_INSERTED;
ERROR 1054 (42S22): Unknown column 'LAST_INSERTED' in 'field list'
mysql> select LAST_INSERTED_NAME
    -> ;
ERROR 1054 (42S22): Unknown column 'LAST_INSERTED_NAME' in 'field list'
mysql> select LAST_INSERTED_NAME()
    -> ;
ERROR 1305 (42000): FUNCTION Chinook.LAST_INSERTED_NAME does not exist
mysql> select LAST_INSERTED_ID();
ERROR 1305 (42000): FUNCTION Chinook.LAST_INSERTED_ID does not exist
mysql> select LAST_INSERT_ID();
+------------------+
| LAST_INSERT_ID() |
+------------------+
|               26 |
+------------------+
1 row in set (0.00 sec)

mysql> select LAST_INSERT_NAME();
ERROR 1305 (42000): FUNCTION Chinook.LAST_INSERT_NAME does not exist
mysql> select LAST_INSERT_ID();
+------------------+
| LAST_INSERT_ID() |
+------------------+
|               26 |
+------------------+
1 row in set (0.00 sec)

mysql> select * from Genre where GenreID = 26
    -> ;
+---------+---------+
| GenreId | Name    |
+---------+---------+
|      26 | Duhovna |
+---------+---------+
1 row in set (0.01 sec)

mysql> update Genre set Name = "Spiritual" where Name = "Duhovna"
    -> ;
Query OK, 1 row affected (0.02 sec)
Rows matched: 1  Changed: 1  Warnings: 0

mysql> select * from Genre
    -> ;
+---------+--------------------+
| GenreId | Name               |
+---------+--------------------+
|       1 | Rock               |
|       2 | Jazz               |
|       3 | Metal              |
|       4 | Alternative & Punk |
|       5 | Rock And Roll      |
|       6 | Blues              |
|       7 | Latin              |
|       8 | Reggae             |
|       9 | Pop                |
|      10 | Soundtrack         |
|      11 | Bossa Nova         |
|      12 | Easy Listening     |
|      13 | Heavy Metal        |
|      14 | R&B/Soul           |
|      15 | Electronica/Dance  |
|      16 | World              |
|      17 | Hip Hop/Rap        |
|      18 | Science Fiction    |
|      19 | TV Shows           |
|      20 | Sci Fi & Fantasy   |
|      21 | Drama              |
|      22 | Comedy             |
|      23 | Alternative        |
|      24 | Classical          |
|      25 | Opera              |
|      26 | Spiritual          |
+---------+--------------------+
26 rows in set (0.01 sec)

mysql> delete from Genre where Name = "Spiritual"
    -> ;
Query OK, 1 row affected (0.02 sec)

mysql> select * from Genre where GenreID = 26
    -> ;
Empty set (0.01 sec)

mysql> select * from Genre where Name = "Spiritual"
    -> ;
Empty set (0.01 sec)

mysql> quit
